text	label
As an example, they described a study showing that centenarians of 100 to 107 years of age had higher levels of two DNA repair enzymes, PARP1 and Ku70, than general-population old individuals of 69 to 75 years of age.	negative
The great majority of mutations that are not neutral in their effect are deleterious to a cell's survival.	negative
Numerous studies of this type have indicated that oxidative damage to DNA is particularly important.	negative
Young 4-day-old rats have about 3,000 single-strand breaks and 156 double-strand breaks per neuron, whereas in rats older than 2 years the level of damage increases to about 7,400 single-strand breaks and 600 double-strand breaks per neuron.	negative
Lu et al.[36] studied the transcriptional profiles of the human frontal cortex of individuals ranging from 26 to 106 years of age.	negative
In 2005, Piec et al.[41] found numerous changes in protein expression in rat skeletal muscle with age, including lower levels of several proteins related to myosin and actin.	negative
For instance Hashimoto et al.[44] showed that 8-OHdG accumulates in rat kidney DNA with age.	negative
This has been observed in several cases of accelerated aging and may occur in normal aging too.[47]	negative
In addition to these three conditions, several other human syndromes, that also have defective DNA repair, show several features of premature aging.	negative
In one of the more recent studies, Burkle et al.[114] studied the level of a particular enzyme, Poly ADP ribose polymerase, which is involved in repair of single-strand breaks in DNA.	negative
It is closely related to the blesmols and is the only species in the genus Heterocephalus.[7]	negative
Queens are larger and may weigh well over 50 grams (1.8 oz), the largest reaching 80 grams (2.8 oz).	negative
The naked mole-rat survives for at least 5 hours in air that contains only 5% oxygen; it does not show any significant signs of distress and continues normal activity.	negative
"However, it has also been claimed that ""the rat has a distinct temperature and activity rhythm that is not coupled to environmental conditions.""[19]"	negative
When they are injected with substance P, a type of neurotransmitter, the pain signaling works as it does in other mammals but only with capsaicin and not with acids.	negative
The combination of p16 and p27 in naked mole-rat cells is a double barrier to uncontrolled cell proliferation, one of the hallmarks of cancer.[24]	negative
A draft genome was made available in 2011[45][46][47] with an improved version released in 2014.[48] Its somatic number is 2n = 60.[7]	negative
These reproducing females tend to have longer bodies than that of their non-reproducing counterparts of the same skull width.	negative
Living in constant darkness, most individuals possess a free-running activity pattern and are active both day and night, sleeping for short periods several times in between.[54]	negative
The tunnel systems built by them can stretch up to three to five kilometres (2–3 mi) in cumulative length.[56]	negative
Circadian rhythms can refer to any process that originates within an organism (i.e., endogenous) and responds to the environment (is entrained by the environment).	negative
"While there are multiple mentions of ""natural body cycle"" in Eastern and Native American cultures, the earliest recorded Western account of a circadian process is credited to Theophrastus, dating from the 4th century BC, probably provided to him by report of Androsthenes, a ship's captain serving under Alexander the Great."	negative
"Ron Konopka and Seymour Benzer identified the first clock mutation in Drosophila in 1971, naming the gene ""period"" (per) gene, the first discovered genetic determinant of behavioral rhythmicity.[20]"	negative
At the same time, Michael W. Young's team reported similar effects of per, and that the gene covers 7.1-kilobase (kb) interval on the X chromosome and encodes a 4.5-kb poly(A)+ RNA.[23][24]	negative
"The external stimulus used to entrain a rhythm is called the zeitgeber, or ""time giver""."	negative
Recent studies instead highlight the importance of co-evolution of redox proteins with circadian oscillators in all three domains of life following the Great Oxidation Event approximately 2.3 billion years ago.	negative
However, it is not clear whether there is a strong association between clock gene polymorphisms in humans and the susceptibility to develop the metabolic syndrome.	negative
In one study of reindeer, animals at 70 degrees North showed circadian rhythms in the autumn, winter and spring, but not in the summer.	negative
These rhythms are endogenously generated, self-sustaining and are relatively constant over a range of ambient temperatures. Important features include two interacting transcription-translation feedback loops: proteins containing PAS domains, which facilitate protein-protein interactions; and several photoreceptors that fine-tune the clock to different light conditions.	negative
The central oscillator generates a self-sustaining rhythm and is driven by two interacting feedback loops that are active at different times of day.	negative
Therapeutic approaches primarily aim to manage symptoms, reduce immune system activity, and maintain the body's ability to fight diseases.	negative
The initial recognition of autoimmune diseases dates back to the early 1900s, and since then, advancements in understanding and management of these conditions have been substantial, though much more is needed to fully unravel their complex etiology and pathophysiology.[10]	negative
An individual may simultaneously have more than one autoimmune disease (known as polyautoimmunity), further complicating the symptomatology.	negative
A 2015 US survey found that 98% of people with autoimmune diseases experienced fatigue, 89% said it was a “major issue”, 68% said “fatigue is anything but normal. It is profound and prevents [them] from doing the simplest everyday tasks.” and 59% said it was “probably the most debilitating symptom of having an AD.”	negative
The impacts of these diseases can range from localized damage to certain tissues, alteration in organ growth and function, to more systemic effects when multiple tissues throughout the body are affected.	negative
The appearance of these signs and symptoms can not only provide clues for the diagnosis of an autoimmune condition, often in conjunction with tests for specific biological markers, but also help monitor disease progression and response to treatment.	negative
Coeliac disease is an immune reaction to eating gluten, a protein found in wheat, barley, and rye.	negative
[18] This explains the increased risk of gastrointestinal cancers, as the gastrointestinal tract includes the esophagus, stomach, small intestine, large intestine, rectum, and anus, all areas that the ingested gluten would traverse in digestion.	negative
Symptoms include severe diarrhea, abdominal pain, fatigue, and weight loss.	negative
Some individuals with psoriasis also develop psoriatic arthritis, which causes joint pain, stiffness, and swelling.	negative
B cells produce antibody molecules which may be either secreted or inserted into the plasma membrane where they serve as a part of B-cell receptors.	negative
To complete development, immature B cells migrate from the bone marrow into the spleen as transitional B cells, passing through two transitional stages: T1 and T2.	negative
They are named as such because they are unable to induce a humoral response in organisms that lack T cells.	negative
The second step consists of activated B cells entering a lymphoid follicle and forming a germinal center (GC), which is a specialized microenvironment where B cells undergo extensive proliferation, immunoglobulin class switching, and affinity maturation directed by somatic hypermutation.	negative
B cells activated by TI antigens go on to proliferate outside lymphoid follicles but still in SLOs (GCs do not form), possibly undergo immunoglobulin class switching, and differentiate into short-lived plasmablasts that produce early, weak antibodies mostly of class IgM, but also some populations of long-lived plasma cells.	negative
There is evidence that B cells first differentiate into a plasmablast-like cell, then differentiate into a plasma cell.	negative
No common Breg cell identity has been described and many Breg cell subsets sharing regulatory functions have been found in both mice and humans.	negative
Abnormal B cells may be relatively large and some diseases include this in their names, such as diffuse large B-cell lymphomas (DLBCLs) and intravascular large B-cell lymphoma.	negative
It is currently unknown if Breg cell subsets are developmentally linked and how exactly differentiation into a Breg cell occurs.	negative
they are provided either by recognition and binding of a common microbial constituent to toll-like receptors (TLRs) or by extensive crosslinking of BCRs	negative
Lupus is usually influenced by gene polymorphisms, 30 of which have now been linked with the disorder.	negative
Asian, African, and Native Americans are more likely to get lupus than Caucasians.	negative
Some other tests that may need to be run include:	negative
The goal for treatment is to prevent flare ups and reduce organ damage.	negative
Treatment consists primarily of immunosuppressive drugs (e.g., hydroxychloroquine and corticosteroids).	negative
Females in the UK are seven times more likely to be diagnosed with SLE than males.	negative
The rarity of legitimate diagnoses in the show eventually became described as a running gag.	negative
A second-line drug is methotrexate in its low-dose schedule.	negative
In 2011, the U.S. Food and Drug Administration (FDA) approved the first new drug for the disease in more than 50 years to be used in the US, belimumab.	negative
People with SLE treated with standard care experience a higher risk of opportunistic infections and death than the general population.	negative
Some joints, such as the knee, elbow, and shoulder, are self-lubricating, almost frictionless, and are able to withstand compression and maintain heavy loads while still executing smooth and precise movements.	negative
In practice, there is significant overlap between the two types of classifications.	negative
A further classification is according to the number and shapes of the articular surfaces: flat, concave and convex surfaces.	negative
According to the anatomic classification, they are subdivided into simple and compound, depending on the number of bones involved, and into complex and combination.	negative
It is caused by psychological tension and misalignment of the jaw (malocclusion), and may be affecting as many as 75 million Americans.	negative
Cereal flour consists either of the endosperm, germ, and bran together (whole-grain flour) or of the endosperm alone (refined flour).	negative
Transportation distances and a relatively slow distribution system collided with natural shelf life.	negative
"Today, ""stone-ground"" usually means that the grain has been ground in a mill in which a revolving stone wheel turns over a stationary stone wheel, vertically or horizontally with the grain in between."	negative
Bromination of flour in the US has fallen out of favor, and while it is not yet actually banned anywhere, few retail flours available to the home baker are bromated anymore.	negative
In America, it is also likely to be pre-salted; in Britain this is not the case.	negative
Chlorine dioxide can decompose violently when separated from diluting substances.	negative
The commercially more important production route uses methanol as the reducing agent and sulfuric acid for the acidity.	negative
The variant process using sodium chlorate, hydrogen peroxide and sulfuric acid has been increasingly used since 1999 for water treatment and other small-scale disinfection applications.	negative
The use of chlorine dioxide minimizes the amount of organochlorine compounds produced.[20]	negative
This warning was repeated for a third time on 12 August 2019, and a fourth on 8 April 2020, stating that ingesting MMS is just as hazardous as ingesting bleach, and urging consumers not to use them or give these products to their children for any reason.	negative
If it contacts the skin or the eyes or is inhaled it causes pain and redness. However, it is more dangerous when ingested.	negative
The complete peroxidation of BaO to BaO2 occurs at moderate temperatures but the increased entropy of the O2 molecule at high temperatures means that BaO2 decomposes to O2 and BaO at 1175K.	negative
It also has use as an ethoxylation catalyst in the reaction of ethylene oxide and alcohols, which takes place between 150 and 200 °C.	negative
Excessive quantities of barium oxide may lead to death.	negative
It has been demonstrated that the interaction of a virus with species-specific receptors is a primary determinant of host tropism and therefore constitutes a major interspecies barrier at the level of viral entry (8).	negative
This can be explained by the sensory profile of green dark vegetables, which tend to be bitter, a taste innately rejected by humans [68].	negative
Additionally, two mothers mentioned the importance of eating vegetables in order to maintain a healthy body weight.Because I’ve been away a lot, the only thing I realized is that it is the way to stop my son from being overweight, I have seen my nephews and they don’t eat vegetables.	negative
We have no explanation for why two-word systems are avoided.	negative
Systemic antibiotic administration can decrease overall infection rates, however there is evidence that local administration further reduces infection [9].	negative
It is therefore important to determine the speed at which contaminants are removed from the aqueous solution on the basis of the experiments, in order to be able to design the sorption process [100].	negative